{
  "code_blocks": [
    {
      "code": "dataset = xdr_data\n| filter event_type = ENUM.AUTH and action_auth_result = \"FAIL\"\n| filter _time >= ago(24h)\n| comp count() as failed_attempts by actor_user, action_remote_ip\n| filter failed_attempts > 5\n| sort desc failed_attempts",
      "language": "xql"
    }
  ],
  "created_at": "2026-05-10T03:16:00Z",
  "id": "202605100316",
  "module_slug": "cortex-xsiam",
  "product_module": "Cortex XSIAM",
  "scenario": "A security analyst notices an increase in authentication alerts within a Cortex XDR and XSIAM environment. To determine whether this is normal user behaviour or a possible brute-force attack, the analyst runs an XQL query to identify repeated failed login attempts coming from the same IP address.\n\nThe query searches authentication logs from the past 24 hours and highlights accounts with more than five failed sign-in attempts from a single remote IP.",
  "schema_version": 1,
  "snippet": "Identify repeated failed login attempts from the same IP address during the past 24 hours.",
  "tags": [
    "agent",
    "detection",
    "xql"
  ],
  "time_to_implement": "15 min"
}

