{
  "created_at": "2026-01-03T00:03:00Z",
  "id": "202601030003",
  "media_base64": "",
  "media_type": "",
  "module_slug": "cortex-xdr",
  "product_module": "Cortex XDR",
  "scenario": "Fixture: a second XDR snippet, used to confirm latest-by-module dedup.",
  "snippet": "Body of the second XDR fixture snippet.",
  "tags": [
    "detection",
    "tuning"
  ],
  "time_to_implement": "15 minutes",
  "schema_version": 1
}
