{
  "id": "202605021115",
  "created_at": "2026-05-02T11:15:00Z",
  "product_module": "Cortex XSIAM",
  "module_slug": "cortex-xsiam",
  "scenario": "My Test Problem.",
  "snippet": "My Test Solution",
  "time_to_implement": "15 minutes",
  "tags": [
    "ingestion",
    "parsing",
    "multi-tenant"
  ],
  "schema_version": 1,
  "code_blocks": []
}
