{
  "code_blocks": [
    {
      "code": "import subprocess\nimport sys\n\ndef add_persistent_null_route(ip_addresses, subnet_mask=\"255.255.255.255\", gateway=\"0.0.0.0\"):\n    \"\"\"\n    Iterates through a list of IP addresses and adds a persistent null route for each.\n    \"\"\"\n    \n    if isinstance(ip_addresses, str):\n        ip_addresses = [ip_addresses]\n\n    print(f\"Starting batch route process for {len(ip_addresses)} targets...\\n\")\n\n    for ip in ip_addresses:\n        ip = ip.strip()\n        command = [\n            \"route\", \"/p\", \"ADD\", \n            ip, \n            \"MASK\", subnet_mask, \n            gateway\n        ]\n\n        try:\n            result = subprocess.run(\n                command, \n                check=True, \n                capture_output=True, \n                text=True\n            )\n            print(f\"[SUCCESS] Route added for: {ip}\")\n            \n        except subprocess.CalledProcessError as e:\n            print(f\"[ERROR] Failed to add {ip}. (Check Admin privileges)\")\n            print(f\"Details: {e.stderr.strip()}\")\n            # Continue to the next IP instead of exiting immediately\n            continue\n            \n        except Exception as e:\n            print(f\"[ERROR] An unexpected error occurred for {ip}: {e}\")\n\n# --- Main execution ---\nif __name__ == \"__main__\":\n    # You can now provide an array of target IPs\n    blackhole_list = [\n        \"127.0.0.1\",\n        \"127.0.0.1\",\n        \"127.0.0.1\"\n    ]\n    \n    add_persistent_null_route(blackhole_list)",
      "language": "python"
    }
  ],
  "created_at": "2026-05-11T05:22:00Z",
  "id": "202605110522",
  "module_slug": "cortex-xsiam",
  "product_module": "Cortex XSIAM",
  "scenario": "Whilst monitoring a high-value workstation, a security analyst recognises an unusual process attempting to reach out to a suspicious public IP address. Rather than abruptly terminating the connection—which might alert a sophisticated adversary that their presence has been detected—the team chooses to quietly steer this traffic towards a secure internal sinkhole.\n\nUpon investigation, the Analyst identifies additional IP addresses that need to be sinkholed and adds these to the array.\n",
  "schema_version": 1,
  "snippet": "This script takes a Python list of IP addresses, joins them into a single comma-separated string, and passes them into one consolidated Windows Firewall rule using PowerShell. \n\nBy using the -Force switch, it efficiently overwrites any previous version of the rule to ensure your entire \\\"naughty list\\\" is blocked in one clean sweep. \n\nTo implement, run this script via `Action Center` %yourtenant%.paloaltonetworks.com/action-center/new/general?from=ALL , choose \"Run Endpoint Script\", \"Code Snippet\", paste the value from the code section under `Snippet` and then move through your target selection etc.",
  "tags": [
    "detection",
    "enrichment",
    "multi-tenant",
    "reporting",
    "xql"
  ],
  "time_to_implement": "5 minutes"
}
