{
  "code_blocks": [
    {
      "code": "dataset = xdr_data\n| filter _time > to_timestamp(current_time() - 86400 * 7, \"SECONDS\")\n| filter event_type = ENUM.PROCESS and event_sub_type = ENUM.PROCESS_START\n| filter lowercase(action_process_image_name) = \"reg.exe\"\n| filter lowercase(action_process_image_command_line) contains \" add \"\n| filter lowercase(action_process_image_command_line) contains \"\\\\currentversion\\\\run\"\n    or lowercase(action_process_image_command_line) contains \"\\\\currentversion\\\\runonce\"\n| fields _time, agent_hostname, actor_effective_username,\n    causality_actor_process_image_name, action_process_image_command_line\n| limit 200",
      "language": "xql"
    }
  ],
  "created_at": "2026-05-18T09:09:00Z",
  "id": "202605180909",
  "module_slug": "cortex-xdr",
  "product_module": "Cortex XDR",
  "scenario": "Run key persistence written via reg.exe.",
  "schema_version": 1,
  "snippet": "Scenario: imagine an attacker establishing user-mode persistence by writing a value under the `Run` or `RunOnce` registry keys with `reg.exe add`. Trivial to deploy, trivial to spot if you are looking.\n\n- https://attack.mitre.org/techniques/T1547/001/\n- https://learn.microsoft.com/en-us/windows/win32/setupapi/run-and-runonce-registry-keys\n\nLogic: spotted via the literal Run/RunOnce key path on the command line.\nFor full coverage pair this with a registry-event hunt; this snippet is the quick check that does not require deeper telemetry plumbing.",
  "tags": [
    "alerts",
    "detection",
    "multi-tenant",
    "xql"
  ],
  "time_to_implement": "5 minutes"
}
