{
  "code_blocks": [
    {
      "code": "dataset = xdr_data\n| filter _time > to_timestamp(current_time() - 86400 * 7, \"SECONDS\")\n| filter event_type = ENUM.PROCESS and event_sub_type = ENUM.PROCESS_START\n| filter lowercase(action_process_image_name) in (\"vssadmin.exe\", \"wmic.exe\", \"wbadmin.exe\")\n| filter (lowercase(action_process_image_command_line) contains \"delete\"\n        and lowercase(action_process_image_command_line) contains \"shadow\")\n    or lowercase(action_process_image_command_line) contains \"delete catalog\"\n| fields _time, agent_hostname, actor_effective_username,\n    causality_actor_process_image_name, action_process_image_command_line\n| limit 200",
      "language": "xql"
    }
  ],
  "created_at": "2026-05-18T08:36:00Z",
  "id": "202605180836",
  "module_slug": "cortex-xdr",
  "product_module": "Cortex XDR",
  "scenario": "Volume Shadow Copy deletion.",
  "schema_version": 1,
  "snippet": "Scenario: a scenario immediately preceding a ransomware encryption stage,\nwhere shadow copies are wiped so users cannot restore files locally. The\n`vssadmin delete shadows /all /quiet` pattern is durable and remains one of\nthe most reliable pre-encryption tells.\n\n- https://attack.mitre.org/techniques/T1490/\n- https://www.cisa.gov/stopransomware\n\nLogic: covers the three usual binaries used for backup destruction\n(`vssadmin`, `wmic shadowcopy`, `wbadmin delete catalog`). Any single hit on a workstation should be treated as a likely ransomware precursor.",
  "tags": [
    "alerts",
    "detection",
    "multi-tenant",
    "xql"
  ],
  "time_to_implement": "5 minutes"
}
