{
  "code_blocks": [
    {
      "code": "dataset = xdr_data\n| filter _time > to_timestamp(current_time() - 86400 * 7, \"SECONDS\")\n| filter event_type = ENUM.PROCESS and event_sub_type = ENUM.PROCESS_START\n| filter lowercase(action_process_image_name) = \"schtasks.exe\"\n| filter lowercase(action_process_image_command_line) contains \"/create\"\n| filter lowercase(actor_process_image_name) in (\n    \"wscript.exe\", \"cscript.exe\", \"mshta.exe\", \"powershell.exe\", \"pwsh.exe\",\n    \"winword.exe\", \"excel.exe\", \"outlook.exe\")\n| fields _time, agent_hostname, actor_effective_username,\n    actor_process_image_name, action_process_image_command_line\n| limit 200",
      "language": "xql"
    }
  ],
  "created_at": "2026-05-18T09:10:00Z",
  "id": "202605180910",
  "module_slug": "cortex-xdr",
  "product_module": "Cortex XDR",
  "scenario": "Scheduled task created by a script-host parent.",
  "schema_version": 1,
  "snippet": "Scenario: a phishing payload or web-shell drops a scheduled task for persistence. The unusual part is rarely the task itself but its parent: a script host (`wscript`, `cscript`, `powershell`, `mshta`) launching `schtasks /create` is a notable shape.\n\n- https://attack.mitre.org/techniques/T1053/005/\n- https://learn.microsoft.com/en-us/windows/win32/taskschd/task-scheduler-start-page\n\nLogic: combines the action (task creation) with a parent that should rarely ever schedule tasks. Tune the parent list to your environment.",
  "tags": [
    "alerts",
    "detection",
    "multi-tenant",
    "xql"
  ],
  "time_to_implement": "5 minutes"
}
