{
  "created_at": "2026-01-01T00:01:00Z",
  "id": "202601010001",
  "media_base64": "",
  "media_type": "",
  "module_slug": "cortex-xdr",
  "product_module": "Cortex XDR",
  "scenario": "Fixture: a basic snippet with no media.",
  "snippet": "Body of the basic fixture snippet.",
  "tags": [
    "detection",
    "tuning"
  ],
  "time_to_implement": "5 minutes",
  "schema_version": 1
}
